"<ID|readonly|noverify>";"<English>";"<French>";"<Italian>";"<German>";"<Spanish>";"<Russian>";"<Polish>";"<Czech>";"<Turkish>";"<Chinese>";"<Japanese>";"<Portuguese>";"<Ukrainian>";"<Serbian>";"<Hungarian>";"<Korean>";"<Belarusian>";"<Romanian>";"<TChinese>";"<HChinese>";"<Vietnamese>";"<Comments>";"<max_chars>"
"loading/ship/tip7";"Tashkent was known as the ""Sky-Blue Cruiser"" due to both her Blue-Gray camouflage color and larger then normal displacement.";"You can select targets for anti-aircraft weapons {{ID_SHIP_SELECT_TARGET_AI_MGUN}}.";"You can select targets for anti-aircraft weapons {{ID_SHIP_SELECT_TARGET_AI_MGUN}}.";"You can select targets for anti-aircraft weapons {{ID_SHIP_SELECT_TARGET_AI_MGUN}}.";"You can select targets for anti-aircraft weapons {{ID_SHIP_SELECT_TARGET_AI_MGUN}}.";"You can select targets for anti-aircraft weapons {{ID_SHIP_SELECT_TARGET_AI_MGUN}}.";"You can select targets for anti-aircraft weapons {{ID_SHIP_SELECT_TARGET_AI_MGUN}}.";"You can select targets for anti-aircraft weapons {{ID_SHIP_SELECT_TARGET_AI_MGUN}}.";"You can select targets for anti-aircraft weapons {{ID_SHIP_SELECT_TARGET_AI_MGUN}}.";"You can select targets for anti-aircraft weapons {{ID_SHIP_SELECT_TARGET_AI_MGUN}}.";"You can select targets for anti-aircraft weapons {{ID_SHIP_SELECT_TARGET_AI_MGUN}}.";"You can select targets for anti-aircraft weapons {{ID_SHIP_SELECT_TARGET_AI_MGUN}}.";"You can select targets for anti-aircraft weapons {{ID_SHIP_SELECT_TARGET_AI_MGUN}}.";"You can select targets for anti-aircraft weapons {{ID_SHIP_SELECT_TARGET_AI_MGUN}}.";"You can select targets for anti-aircraft weapons {{ID_SHIP_SELECT_TARGET_AI_MGUN}}.";"You can select targets for anti-aircraft weapons {{ID_SHIP_SELECT_TARGET_AI_MGUN}}.";"You can select targets for anti-aircraft weapons {{ID_SHIP_SELECT_TARGET_AI_MGUN}}.";"You can select targets for anti-aircraft weapons {{ID_SHIP_SELECT_TARGET_AI_MGUN}}.";"You can select targets for anti-aircraft weapons {{ID_SHIP_SELECT_TARGET_AI_MGUN}}.";"You can select targets for anti-aircraft weapons {{ID_SHIP_SELECT_TARGET_AI_MGUN}}.";"You can select targets for anti-aircraft weapons {{ID_SHIP_SELECT_TARGET_AI_MGUN}}.";;
"loading/ship/tip8";"HMS Jervis recieved the highest amount of Battle Honours (13) after HMS Warspite (14) while losing no crew to enemy actions, earning her the nickname ""Lucky Jervis"".";"In the menu, you can turn the tracking system on or off for falling shells with a calibre equal to or greater than 100 mm.";"In the menu, you can turn the tracking system on or off for falling shells with a calibre equal to or greater than 100 mm.";"In the menu, you can turn the tracking system on or off for falling shells with a calibre equal to or greater than 100 mm.";"In the menu, you can turn the tracking system on or off for falling shells with a calibre equal to or greater than 100 mm.";"In the menu, you can turn the tracking system on or off for falling shells with a calibre equal to or greater than 100 mm.";"In the menu, you can turn the tracking system on or off for falling shells with a calibre equal to or greater than 100 mm.";"In the menu, you can turn the tracking system on or off for falling shells with a calibre equal to or greater than 100 mm.";"In the menu, you can turn the tracking system on or off for falling shells with a calibre equal to or greater than 100 mm.";"In the menu, you can turn the tracking system on or off for falling shells with a calibre equal to or greater than 100 mm.";"In the menu, you can turn the tracking system on or off for falling shells with a calibre equal to or greater than 100 mm.";"In the menu, you can turn the tracking system on or off for falling shells with a calibre equal to or greater than 100 mm.";"In the menu, you can turn the tracking system on or off for falling shells with a calibre equal to or greater than 100 mm.";"In the menu, you can turn the tracking system on or off for falling shells with a calibre equal to or greater than 100 mm.";"In the menu, you can turn the tracking system on or off for falling shells with a calibre equal to or greater than 100 mm.";"In the menu, you can turn the tracking system on or off for falling shells with a calibre equal to or greater than 100 mm.";"In the menu, you can turn the tracking system on or off for falling shells with a calibre equal to or greater than 100 mm.";"In the menu, you can turn the tracking system on or off for falling shells with a calibre equal to or greater than 100 mm.";"In the menu, you can turn the tracking system on or off for falling shells with a calibre equal to or greater than 100 mm.";"In the menu, you can turn the tracking system on or off for falling shells with a calibre equal to or greater than 100 mm.";"In the menu, you can turn the tracking system on or off for falling shells with a calibre equal to or greater than 100 mm.";;
"loading/ship/newbie/tip9";"Ku~ma~, Kuma, Kuma?";"Ku~ma~, Kuma, Kuma?";"Ku~ma~, Kuma, Kuma?";"Ku~ma~, Kuma, Kuma?";"Ku~ma~, Kuma, Kuma?";"Ku~ma~, Kuma, Kuma?";"Ku~ma~, Kuma, Kuma?";"Ku~ma~, Kuma, Kuma?";"Ku~ma~, Kuma, Kuma?";"Ku~ma~, Kuma, Kuma?";"Ku~ma~, Kuma, Kuma?";"Ku~ma~, Kuma, Kuma?";"Ku~ma~, Kuma, Kuma?";"Ku~ma~, Kuma, Kuma?";"Ku~ma~, Kuma, Kuma?";"Ku~ma~, Kuma, Kuma?";"Ku~ma~, Kuma, Kuma?";"Ku~ma~, Kuma, Kuma?";"Ku~ma~, Kuma, Kuma?";"Ku~ma~, Kuma, Kuma?";"Ku~ma~, Kuma, Kuma?";;
"loading/ship/newbie/tip10";"It took an estimated 19 torpedo and 17 bomb hits to sink Musashi on the 24th of October 1944.";"You can turn on automatic damage repair {{ID_SHIP_ACTION_BAR_ITEM_11}}.";"You can turn on automatic damage repair {{ID_SHIP_ACTION_BAR_ITEM_11}}.";"You can turn on automatic damage repair {{ID_SHIP_ACTION_BAR_ITEM_11}}.";"You can turn on automatic damage repair {{ID_SHIP_ACTION_BAR_ITEM_11}}.";"You can turn on automatic damage repair {{ID_SHIP_ACTION_BAR_ITEM_11}}.";"You can turn on automatic damage repair {{ID_SHIP_ACTION_BAR_ITEM_11}}.";"You can turn on automatic damage repair {{ID_SHIP_ACTION_BAR_ITEM_11}}.";"You can turn on automatic damage repair {{ID_SHIP_ACTION_BAR_ITEM_11}}.";"You can turn on automatic damage repair {{ID_SHIP_ACTION_BAR_ITEM_11}}.";"You can turn on automatic damage repair {{ID_SHIP_ACTION_BAR_ITEM_11}}.";"You can turn on automatic damage repair {{ID_SHIP_ACTION_BAR_ITEM_11}}.";"You can turn on automatic damage repair {{ID_SHIP_ACTION_BAR_ITEM_11}}.";"You can turn on automatic damage repair {{ID_SHIP_ACTION_BAR_ITEM_11}}.";"You can turn on automatic damage repair {{ID_SHIP_ACTION_BAR_ITEM_11}}.";"You can turn on automatic damage repair {{ID_SHIP_ACTION_BAR_ITEM_11}}.";"You can turn on automatic damage repair {{ID_SHIP_ACTION_BAR_ITEM_11}}.";"You can turn on automatic damage repair {{ID_SHIP_ACTION_BAR_ITEM_11}}.";"You can turn on automatic damage repair {{ID_SHIP_ACTION_BAR_ITEM_11}}.";"You can turn on automatic damage repair {{ID_SHIP_ACTION_BAR_ITEM_11}}.";"You can turn on automatic damage repair {{ID_SHIP_ACTION_BAR_ITEM_11}}.";;
"loading/ship/newbie/tip11";"Yūdachi recieved the nickname ""Nightmare of Solomon"" due to her actions during the First Naval Battle of Guadalcanal.";"You can turn on automatic fire extinguishing {{ID_SHIP_ACTION_BAR_ITEM_6}}.";"You can turn on automatic fire extinguishing {{ID_SHIP_ACTION_BAR_ITEM_6}}.";"You can turn on automatic fire extinguishing {{ID_SHIP_ACTION_BAR_ITEM_6}}.";"You can turn on automatic fire extinguishing {{ID_SHIP_ACTION_BAR_ITEM_6}}.";"You can turn on automatic fire extinguishing {{ID_SHIP_ACTION_BAR_ITEM_6}}.";"You can turn on automatic fire extinguishing {{ID_SHIP_ACTION_BAR_ITEM_6}}.";"You can turn on automatic fire extinguishing {{ID_SHIP_ACTION_BAR_ITEM_6}}.";"You can turn on automatic fire extinguishing {{ID_SHIP_ACTION_BAR_ITEM_6}}.";"You can turn on automatic fire extinguishing {{ID_SHIP_ACTION_BAR_ITEM_6}}.";"You can turn on automatic fire extinguishing {{ID_SHIP_ACTION_BAR_ITEM_6}}.";"You can turn on automatic fire extinguishing {{ID_SHIP_ACTION_BAR_ITEM_6}}.";"You can turn on automatic fire extinguishing {{ID_SHIP_ACTION_BAR_ITEM_6}}.";"You can turn on automatic fire extinguishing {{ID_SHIP_ACTION_BAR_ITEM_6}}.";"You can turn on automatic fire extinguishing {{ID_SHIP_ACTION_BAR_ITEM_6}}.";"You can turn on automatic fire extinguishing {{ID_SHIP_ACTION_BAR_ITEM_6}}.";"You can turn on automatic fire extinguishing {{ID_SHIP_ACTION_BAR_ITEM_6}}.";"You can turn on automatic fire extinguishing {{ID_SHIP_ACTION_BAR_ITEM_6}}.";"You can turn on automatic fire extinguishing {{ID_SHIP_ACTION_BAR_ITEM_6}}.";"You can turn on automatic fire extinguishing {{ID_SHIP_ACTION_BAR_ITEM_6}}.";"You can turn on automatic fire extinguishing {{ID_SHIP_ACTION_BAR_ITEM_6}}.";;
"loading/ship/newbie/tip12";"The USN Des Moines class of Heavy Cruisers was fitted with the fastest firing 203mm guns ever fitted to a Heavy Cruiser, firing at an astonishing rate of 10 rounds per minute.";"If repairs, extinguishing fires, and bailing water are done simultaneously, they take far more time than each of them does alone.";"If repairs, extinguishing fires, and bailing water are done simultaneously, they take far more time than each of them does alone.";"If repairs, extinguishing fires, and bailing water are done simultaneously, they take far more time than each of them does alone.";"If repairs, extinguishing fires, and bailing water are done simultaneously, they take far more time than each of them does alone.";"If repairs, extinguishing fires, and bailing water are done simultaneously, they take far more time than each of them does alone.";"If repairs, extinguishing fires, and bailing water are done simultaneously, they take far more time than each of them does alone.";"If repairs, extinguishing fires, and bailing water are done simultaneously, they take far more time than each of them does alone.";"If repairs, extinguishing fires, and bailing water are done simultaneously, they take far more time than each of them does alone.";"If repairs, extinguishing fires, and bailing water are done simultaneously, they take far more time than each of them does alone.";"If repairs, extinguishing fires, and bailing water are done simultaneously, they take far more time than each of them does alone.";"If repairs, extinguishing fires, and bailing water are done simultaneously, they take far more time than each of them does alone.";"If repairs, extinguishing fires, and bailing water are done simultaneously, they take far more time than each of them does alone.";"If repairs, extinguishing fires, and bailing water are done simultaneously, they take far more time than each of them does alone.";"If repairs, extinguishing fires, and bailing water are done simultaneously, they take far more time than each of them does alone.";"If repairs, extinguishing fires, and bailing water are done simultaneously, they take far more time than each of them does alone.";"If repairs, extinguishing fires, and bailing water are done simultaneously, they take far more time than each of them does alone.";"If repairs, extinguishing fires, and bailing water are done simultaneously, they take far more time than each of them does alone.";"If repairs, extinguishing fires, and bailing water are done simultaneously, they take far more time than each of them does alone.";"If repairs, extinguishing fires, and bailing water are done simultaneously, they take far more time than each of them does alone.";"If repairs, extinguishing fires, and bailing water are done simultaneously, they take far more time than each of them does alone.";;
"loading/ship/tip13";"Due to how hard she fought against IJN Heavy Cruisers at the Battle off Samar, the USS Samuel B. Roberts became known as the ""The Destroyer Escort that fought like a Battleship"".";"In the control menu, you can assign keys to manually control direction and range of fire.";"In the control menu, you can assign keys to manually control direction and range of fire.";"In the control menu, you can assign keys to manually control direction and range of fire.";"In the control menu, you can assign keys to manually control direction and range of fire.";"In the control menu, you can assign keys to manually control direction and range of fire.";"In the control menu, you can assign keys to manually control direction and range of fire.";"In the control menu, you can assign keys to manually control direction and range of fire.";"In the control menu, you can assign keys to manually control direction and range of fire.";"In the control menu, you can assign keys to manually control direction and range of fire.";"In the control menu, you can assign keys to manually control direction and range of fire.";"In the control menu, you can assign keys to manually control direction and range of fire.";"In the control menu, you can assign keys to manually control direction and range of fire.";"In the control menu, you can assign keys to manually control direction and range of fire.";"In the control menu, you can assign keys to manually control direction and range of fire.";"In the control menu, you can assign keys to manually control direction and range of fire.";"In the control menu, you can assign keys to manually control direction and range of fire.";"In the control menu, you can assign keys to manually control direction and range of fire.";"In the control menu, you can assign keys to manually control direction and range of fire.";"In the control menu, you can assign keys to manually control direction and range of fire.";"In the control menu, you can assign keys to manually control direction and range of fire.";;
"loading/ship/tip14";"Aoba is one of the luckiest unlucky ships ever; surviving a 500lb bomb hit, her own torpedoes detonating, enemy gun barrages, a friendly collision and mutliple torpedo strikes before sinking in port on the 24th of July 1945.";"In the control menu, you can assign a key to fire a ranging shot from a main calibre gun or turret.";"In the control menu, you can assign a key to fire a ranging shot from a main calibre gun or turret.";"In the control menu, you can assign a key to fire a ranging shot from a main calibre gun or turret.";"In the control menu, you can assign a key to fire a ranging shot from a main calibre gun or turret.";"In the control menu, you can assign a key to fire a ranging shot from a main calibre gun or turret.";"In the control menu, you can assign a key to fire a ranging shot from a main calibre gun or turret.";"In the control menu, you can assign a key to fire a ranging shot from a main calibre gun or turret.";"In the control menu, you can assign a key to fire a ranging shot from a main calibre gun or turret.";"In the control menu, you can assign a key to fire a ranging shot from a main calibre gun or turret.";"In the control menu, you can assign a key to fire a ranging shot from a main calibre gun or turret.";"In the control menu, you can assign a key to fire a ranging shot from a main calibre gun or turret.";"In the control menu, you can assign a key to fire a ranging shot from a main calibre gun or turret.";"In the control menu, you can assign a key to fire a ranging shot from a main calibre gun or turret.";"In the control menu, you can assign a key to fire a ranging shot from a main calibre gun or turret.";"In the control menu, you can assign a key to fire a ranging shot from a main calibre gun or turret.";"In the control menu, you can assign a key to fire a ranging shot from a main calibre gun or turret.";"In the control menu, you can assign a key to fire a ranging shot from a main calibre gun or turret.";"In the control menu, you can assign a key to fire a ranging shot from a main calibre gun or turret.";"In the control menu, you can assign a key to fire a ranging shot from a main calibre gun or turret.";"In the control menu, you can assign a key to fire a ranging shot from a main calibre gun or turret.";;
"loading/ship/tip15";"USS Tang is one of the few boats with the questionable honor of sinking herself with her own torpedo, bringing her total up to 34 vessels sunk.";"On large ships, you will lose all the shells in your ammo magazine if they catch fire.";"On large ships, you will lose all the shells in your ammo magazine if they catch fire.";"On large ships, you will lose all the shells in your ammo magazine if they catch fire.";"On large ships, you will lose all the shells in your ammo magazine if they catch fire.";"On large ships, you will lose all the shells in your ammo magazine if they catch fire.";"On large ships, you will lose all the shells in your ammo magazine if they catch fire.";"On large ships, you will lose all the shells in your ammo magazine if they catch fire.";"On large ships, you will lose all the shells in your ammo magazine if they catch fire.";"On large ships, you will lose all the shells in your ammo magazine if they catch fire.";"On large ships, you will lose all the shells in your ammo magazine if they catch fire.";"On large ships, you will lose all the shells in your ammo magazine if they catch fire.";"On large ships, you will lose all the shells in your ammo magazine if they catch fire.";"On large ships, you will lose all the shells in your ammo magazine if they catch fire.";"On large ships, you will lose all the shells in your ammo magazine if they catch fire.";"On large ships, you will lose all the shells in your ammo magazine if they catch fire.";"On large ships, you will lose all the shells in your ammo magazine if they catch fire.";"On large ships, you will lose all the shells in your ammo magazine if they catch fire.";"On large ships, you will lose all the shells in your ammo magazine if they catch fire.";"On large ships, you will lose all the shells in your ammo magazine if they catch fire.";"On large ships, you will lose all the shells in your ammo magazine if they catch fire.";;
"loading/ship/tip16";"There are at least two known cases of IJN vessels hailing the USN during battles; Aoba during the Battle of Cape Esperance and Yuudachi during the First Naval Battle of Guadalcanal.";"If the ammo magazine becomes flooded, all of the shells in it will be inaccessible until the water is pumped out.";"If the ammo magazine becomes flooded, all of the shells in it will be inaccessible until the water is pumped out.";"If the ammo magazine becomes flooded, all of the shells in it will be inaccessible until the water is pumped out.";"If the ammo magazine becomes flooded, all of the shells in it will be inaccessible until the water is pumped out.";"If the ammo magazine becomes flooded, all of the shells in it will be inaccessible until the water is pumped out.";"If the ammo magazine becomes flooded, all of the shells in it will be inaccessible until the water is pumped out.";"If the ammo magazine becomes flooded, all of the shells in it will be inaccessible until the water is pumped out.";"If the ammo magazine becomes flooded, all of the shells in it will be inaccessible until the water is pumped out.";"If the ammo magazine becomes flooded, all of the shells in it will be inaccessible until the water is pumped out.";"If the ammo magazine becomes flooded, all of the shells in it will be inaccessible until the water is pumped out.";"If the ammo magazine becomes flooded, all of the shells in it will be inaccessible until the water is pumped out.";"If the ammo magazine becomes flooded, all of the shells in it will be inaccessible until the water is pumped out.";"If the ammo magazine becomes flooded, all of the shells in it will be inaccessible until the water is pumped out.";"If the ammo magazine becomes flooded, all of the shells in it will be inaccessible until the water is pumped out.";"If the ammo magazine becomes flooded, all of the shells in it will be inaccessible until the water is pumped out.";"If the ammo magazine becomes flooded, all of the shells in it will be inaccessible until the water is pumped out.";"If the ammo magazine becomes flooded, all of the shells in it will be inaccessible until the water is pumped out.";"If the ammo magazine becomes flooded, all of the shells in it will be inaccessible until the water is pumped out.";"If the ammo magazine becomes flooded, all of the shells in it will be inaccessible until the water is pumped out.";"If the ammo magazine becomes flooded, all of the shells in it will be inaccessible until the water is pumped out.";;
"loading/ship/newbie/tip17";"After losing her bow during Typhoon Viper and returning to Guam, USS Pittsburgh recieved the nickname ""longest ship in the Navy"" with her bow recieving the name ""USS McKeesport"".";"If the engine room is flooded, the engines and transmission will be knocked out.";"If the engine room is flooded, the engines and transmission will be knocked out.";"If the engine room is flooded, the engines and transmission will be knocked out.";"If the engine room is flooded, the engines and transmission will be knocked out.";"If the engine room is flooded, the engines and transmission will be knocked out.";"If the engine room is flooded, the engines and transmission will be knocked out.";"If the engine room is flooded, the engines and transmission will be knocked out.";"If the engine room is flooded, the engines and transmission will be knocked out.";"If the engine room is flooded, the engines and transmission will be knocked out.";"If the engine room is flooded, the engines and transmission will be knocked out.";"If the engine room is flooded, the engines and transmission will be knocked out.";"If the engine room is flooded, the engines and transmission will be knocked out.";"If the engine room is flooded, the engines and transmission will be knocked out.";"If the engine room is flooded, the engines and transmission will be knocked out.";"If the engine room is flooded, the engines and transmission will be knocked out.";"If the engine room is flooded, the engines and transmission will be knocked out.";"If the engine room is flooded, the engines and transmission will be knocked out.";"If the engine room is flooded, the engines and transmission will be knocked out.";"If the engine room is flooded, the engines and transmission will be knocked out.";"If the engine room is flooded, the engines and transmission will be knocked out.";;
"loading/ship/newbie/tip18";"The Matsu-class Destroyer Nashi is the only IJN vessel that saw service with the JMSDF, being refloated in 1954 and commissioned as JDS Wakaba in 1956.";"If the funnel is damaged, the maximum forward speed of the vessel is reduced.";"If the funnel is damaged, the maximum forward speed of the vessel is reduced.";"If the funnel is damaged, the maximum forward speed of the vessel is reduced.";"If the funnel is damaged, the maximum forward speed of the vessel is reduced.";"If the funnel is damaged, the maximum forward speed of the vessel is reduced.";"If the funnel is damaged, the maximum forward speed of the vessel is reduced.";"If the funnel is damaged, the maximum forward speed of the vessel is reduced.";"If the funnel is damaged, the maximum forward speed of the vessel is reduced.";"If the funnel is damaged, the maximum forward speed of the vessel is reduced.";"If the funnel is damaged, the maximum forward speed of the vessel is reduced.";"If the funnel is damaged, the maximum forward speed of the vessel is reduced.";"If the funnel is damaged, the maximum forward speed of the vessel is reduced.";"If the funnel is damaged, the maximum forward speed of the vessel is reduced.";"If the funnel is damaged, the maximum forward speed of the vessel is reduced.";"If the funnel is damaged, the maximum forward speed of the vessel is reduced.";"If the funnel is damaged, the maximum forward speed of the vessel is reduced.";"If the funnel is damaged, the maximum forward speed of the vessel is reduced.";"If the funnel is damaged, the maximum forward speed of the vessel is reduced.";"If the funnel is damaged, the maximum forward speed of the vessel is reduced.";"If the funnel is damaged, the maximum forward speed of the vessel is reduced.";;
