"<ID|readonly|noverify>";"<English>";"<French>";"<Italian>";"<German>";"<Spanish>";"<Russian>";"<Polish>";"<Czech>";"<Turkish>";"<Chinese>";"<Japanese>";"<Portuguese>";"<Ukrainian>";"<Serbian>";"<Hungarian>";"<Korean>";"<Belarusian>";"<Romanian>";"<TChinese>";"<HChinese>";"<Vietnamese>";"<Comments>";"<max_chars>"
//Changed or kept tips//
"loading/tip0";"You can use zoom to see the target better.";"You can use zoom to see the target better.";"You can use zoom to see the target better.";"You can use zoom to see the target better.";"You can use zoom to see the target better.";"You can use zoom to see the target better.";"You can use zoom to see the target better.";"You can use zoom to see the target better.";"You can use zoom to see the target better.";"You can use zoom to see the target better.";"You can use zoom to see the target better.";"You can use zoom to see the target better.";"You can use zoom to see the target better.";"You can use zoom to see the target better.";"You can use zoom to see the target better.";"You can use zoom to see the target better.";"You can use zoom to see the target better.";"You can use zoom to see the target better.";"You can use zoom to see the target better.";"You can use zoom to see the target better.";"You can use zoom to see the target better.";;
"loading/tip1";"Make sure to visit the Wiki occasionally. It contains lots of questionable information.";"Make sure to visit the Encyclopedia regularly. It contains lots of useful information.";"Make sure to visit the Encyclopedia regularly. It contains lots of useful information.";"Make sure to visit the Encyclopedia regularly. It contains lots of useful information.";"Make sure to visit the Encyclopedia regularly. It contains lots of useful information.";"Make sure to visit the Encyclopedia regularly. It contains lots of useful information.";"Make sure to visit the Encyclopedia regularly. It contains lots of useful information.";"Make sure to visit the Encyclopedia regularly. It contains lots of useful information.";"Make sure to visit the Encyclopedia regularly. It contains lots of useful information.";"Make sure to visit the Encyclopedia regularly. It contains lots of useful information.";"Make sure to visit the Encyclopedia regularly. It contains lots of useful information.";"Make sure to visit the Encyclopedia regularly. It contains lots of useful information.";"Make sure to visit the Encyclopedia regularly. It contains lots of useful information.";"Make sure to visit the Encyclopedia regularly. It contains lots of useful information.";"Make sure to visit the Encyclopedia regularly. It contains lots of useful information.";"Make sure to visit the Encyclopedia regularly. It contains lots of useful information.";"Make sure to visit the Encyclopedia regularly. It contains lots of useful information.";"Make sure to visit the Encyclopedia regularly. It contains lots of useful information.";"Make sure to visit the Encyclopedia regularly. It contains lots of useful information.";"Make sure to visit the Encyclopedia regularly. It contains lots of useful information.";"Make sure to visit the Encyclopedia regularly. It contains lots of useful information.";;
"loading/tip2";"You can use the mouse look button {{ID_CAMERA_NEUTRAL}} to look around.";"You can use the mouse look button {{ID_CAMERA_NEUTRAL}} to look around.";"You can use the mouse look button {{ID_CAMERA_NEUTRAL}} to look around.";"You can use the mouse look button {{ID_CAMERA_NEUTRAL}} to look around.";"You can use the mouse look button {{ID_CAMERA_NEUTRAL}} to look around.";"You can use the mouse look button {{ID_CAMERA_NEUTRAL}} to look around.";"You can use the mouse look button {{ID_CAMERA_NEUTRAL}} to look around.";"You can use the mouse look button {{ID_CAMERA_NEUTRAL}} to look around.";"You can use the mouse look button {{ID_CAMERA_NEUTRAL}} to look around.";"You can use the mouse look button {{ID_CAMERA_NEUTRAL}} to look around.";"You can use the mouse look button {{ID_CAMERA_NEUTRAL}} to look around.";"You can use the mouse look button {{ID_CAMERA_NEUTRAL}} to look around.";"You can use the mouse look button {{ID_CAMERA_NEUTRAL}} to look around.";"You can use the mouse look button {{ID_CAMERA_NEUTRAL}} to look around.";"You can use the mouse look button {{ID_CAMERA_NEUTRAL}} to look around.";"You can use the mouse look button {{ID_CAMERA_NEUTRAL}} to look around.";"You can use the mouse look button {{ID_CAMERA_NEUTRAL}} to look around.";"You can use the mouse look button {{ID_CAMERA_NEUTRAL}} to look around.";"You can use the mouse look button {{ID_CAMERA_NEUTRAL}} to look around.";"You can use the mouse look button {{ID_CAMERA_NEUTRAL}} to look around.";"You can use the mouse look button {{ID_CAMERA_NEUTRAL}} to look around.";;
"loading/tip3";"You can send short messages to your team using the special menu {{ID_SHOW_VOICE_MESSAGE_LIST}}, every player will see them in their set client language.";"You can send short messages to your team using the special menu {{ID_SHOW_VOICE_MESSAGE_LIST}}, every player will see them in their own language";"You can send short messages to your team using the special menu {{ID_SHOW_VOICE_MESSAGE_LIST}}, every player will see them in their own language";"You can send short messages to your team using the special menu {{ID_SHOW_VOICE_MESSAGE_LIST}}, every player will see them in their own language";"You can send short messages to your team using the special menu {{ID_SHOW_VOICE_MESSAGE_LIST}}, every player will see them in their own language";"You can send short messages to your team using the special menu {{ID_SHOW_VOICE_MESSAGE_LIST}}, every player will see them in their own language";"You can send short messages to your team using the special menu {{ID_SHOW_VOICE_MESSAGE_LIST}}, every player will see them in their own language";"You can send short messages to your team using the special menu {{ID_SHOW_VOICE_MESSAGE_LIST}}, every player will see them in their own language";"You can send short messages to your team using the special menu {{ID_SHOW_VOICE_MESSAGE_LIST}}, every player will see them in their own language";"You can send short messages to your team using the special menu {{ID_SHOW_VOICE_MESSAGE_LIST}}, every player will see them in their own language";"You can send short messages to your team using the special menu {{ID_SHOW_VOICE_MESSAGE_LIST}}, every player will see them in their own language";"You can send short messages to your team using the special menu {{ID_SHOW_VOICE_MESSAGE_LIST}}, every player will see them in their own language";"You can send short messages to your team using the special menu {{ID_SHOW_VOICE_MESSAGE_LIST}}, every player will see them in their own language";"You can send short messages to your team using the special menu {{ID_SHOW_VOICE_MESSAGE_LIST}}, every player will see them in their own language";"You can send short messages to your team using the special menu {{ID_SHOW_VOICE_MESSAGE_LIST}}, every player will see them in their own language";"You can send short messages to your team using the special menu {{ID_SHOW_VOICE_MESSAGE_LIST}}, every player will see them in their own language";"You can send short messages to your team using the special menu {{ID_SHOW_VOICE_MESSAGE_LIST}}, every player will see them in their own language";"You can send short messages to your team using the special menu {{ID_SHOW_VOICE_MESSAGE_LIST}}, every player will see them in their own language";"You can send short messages to your team using the special menu {{ID_SHOW_VOICE_MESSAGE_LIST}}, every player will see them in their own language";"You can send short messages to your team using the special menu {{ID_SHOW_VOICE_MESSAGE_LIST}}, every player will see them in their own language";"You can send short messages to your team using the special menu {{ID_SHOW_VOICE_MESSAGE_LIST}}, every player will see them in their own language";;
"loading/help_tip01";"While in battle, press F1 to view help on the controls.";"While in battle, press F1 to view help on the controls.";"While in battle, press F1 to view help on the controls.";"While in battle, press F1 to view help on the controls.";"While in battle, press F1 to view help on the controls.";"While in battle, press F1 to view help on the controls.";"While in battle, press F1 to view help on the controls.";"While in battle, press F1 to view help on the controls.";"While in battle, press F1 to view help on the controls.";"While in battle, press F1 to view help on the controls.";"While in battle, press F1 to view help on the controls.";"While in battle, press F1 to view help on the controls.";"While in battle, press F1 to view help on the controls.";"While in battle, press F1 to view help on the controls.";"While in battle, press F1 to view help on the controls.";"While in battle, press F1 to view help on the controls.";"While in battle, press F1 to view help on the controls.";"While in battle, press F1 to view help on the controls.";"While in battle, press F1 to view help on the controls.";"While in battle, press F1 to view help on the controls.";"While in battle, press F1 to view help on the controls.";;
//air//
"loading/aircraft/newbie/tip0";"Tracers work both ways.";"Tracers work both ways.";"Tracers work both ways.";"Tracers work both ways.";"Tracers work both ways.";"Tracers work both ways.";"Tracers work both ways.";"Tracers work both ways.";"Tracers work both ways.";"Tracers work both ways.";"Tracers work both ways.";"Tracers work both ways.";"Tracers work both ways.";"Tracers work both ways.";"Tracers work both ways.";"Tracers work both ways.";"Tracers work both ways.";"Tracers work both ways.";"Tracers work both ways.";"Tracers work both ways.";"Tracers work both ways.";;
"loading/aircraft/tip1";"Go dance with the angels! ╗╘";"The Immelmann is an effective way to change direction in combat.";"The Immelmann is an effective way to change direction in combat.";"The Immelmann is an effective way to change direction in combat.";"The Immelmann is an effective way to change direction in combat.";"The Immelmann is an effective way to change direction in combat.";"The Immelmann is an effective way to change direction in combat.";"The Immelmann is an effective way to change direction in combat.";"The Immelmann is an effective way to change direction in combat.";"The Immelmann is an effective way to change direction in combat.";"The Immelmann is an effective way to change direction in combat.";"The Immelmann is an effective way to change direction in combat.";"The Immelmann is an effective way to change direction in combat.";"The Immelmann is an effective way to change direction in combat.";"The Immelmann is an effective way to change direction in combat.";"The Immelmann is an effective way to change direction in combat.";"The Immelmann is an effective way to change direction in combat.";"The Immelmann is an effective way to change direction in combat.";"The Immelmann is an effective way to change direction in combat.";"The Immelmann is an effective way to change direction in combat.";"The Immelmann is an effective way to change direction in combat.";;
"loading/aircraft/tip2";"A Barrel Roll isn't the same as an Aileron Roll.";"A loop can help you get onto your opponent's tail.";"A loop can help you get onto your opponent's tail.";"A loop can help you get onto your opponent's tail.";"A loop can help you get onto your opponent's tail.";"A loop can help you get onto your opponent's tail.";"A loop can help you get onto your opponent's tail.";"A loop can help you get onto your opponent's tail.";"A loop can help you get onto your opponent's tail.";"A loop can help you get onto your opponent's tail.";"A loop can help you get onto your opponent's tail.";"A loop can help you get onto your opponent's tail.";"A loop can help you get onto your opponent's tail.";"A loop can help you get onto your opponent's tail.";"A loop can help you get onto your opponent's tail.";"A loop can help you get onto your opponent's tail.";"A loop can help you get onto your opponent's tail.";"A loop can help you get onto your opponent's tail.";"A loop can help you get onto your opponent's tail.";"A loop can help you get onto your opponent's tail.";"A loop can help you get onto your opponent's tail.";;
"loading/aircraft/newbie/tip3";"Every call out that can be misunderstood, will be.";"Every call out that can be misunderstood, will be.";"Every call out that can be misunderstood, will be.";"Every call out that can be misunderstood, will be.";"Every call out that can be misunderstood, will be.";"Every call out that can be misunderstood, will be.";"Every call out that can be misunderstood, will be.";"Every call out that can be misunderstood, will be.";"Every call out that can be misunderstood, will be.";"Every call out that can be misunderstood, will be.";"Every call out that can be misunderstood, will be.";"Every call out that can be misunderstood, will be.";"Every call out that can be misunderstood, will be.";"Every call out that can be misunderstood, will be.";"Every call out that can be misunderstood, will be.";"Every call out that can be misunderstood, will be.";"Every call out that can be misunderstood, will be.";"Every call out that can be misunderstood, will be.";"Every call out that can be misunderstood, will be.";"Every call out that can be misunderstood, will be.";"Every call out that can be misunderstood, will be.";;
"loading/aircraft/newbie/tip4";"Friendly fire isn't.";"Use the Target Camera {{ID_TARGET_CAMERA}}.";"Use the Target Camera {{ID_TARGET_CAMERA}}.";"Use the Target Camera {{ID_TARGET_CAMERA}}.";"Use the Target Camera {{ID_TARGET_CAMERA}}.";"Use the Target Camera {{ID_TARGET_CAMERA}}.";"Use the Target Camera {{ID_TARGET_CAMERA}}.";"Use the Target Camera {{ID_TARGET_CAMERA}}.";"Use the Target Camera {{ID_TARGET_CAMERA}}.";"Use the Target Camera {{ID_TARGET_CAMERA}}.";"Use the Target Camera {{ID_TARGET_CAMERA}}.";"Use the Target Camera {{ID_TARGET_CAMERA}}.";"Use the Target Camera {{ID_TARGET_CAMERA}}.";"Use the Target Camera {{ID_TARGET_CAMERA}}.";"Use the Target Camera {{ID_TARGET_CAMERA}}.";"Use the Target Camera {{ID_TARGET_CAMERA}}.";"Use the Target Camera {{ID_TARGET_CAMERA}}.";"Use the Target Camera {{ID_TARGET_CAMERA}}.";"Use the Target Camera {{ID_TARGET_CAMERA}}.";"Use the Target Camera {{ID_TARGET_CAMERA}}.";"Use the Target Camera {{ID_TARGET_CAMERA}}.";;

"loading/aircraft/newbie/tip6";"Airspeed is life. Altitude is insurance.";"Always try to have an altitude advantage over your opponent.";"Always try to have an altitude advantage over your opponent.";"Always try to have an altitude advantage over your opponent.";"Always try to have an altitude advantage over your opponent.";"Always try to have an altitude advantage over your opponent.";"Always try to have an altitude advantage over your opponent.";"Always try to have an altitude advantage over your opponent.";"Always try to have an altitude advantage over your opponent.";"Always try to have an altitude advantage over your opponent.";"Always try to have an altitude advantage over your opponent.";"Always try to have an altitude advantage over your opponent.";"Always try to have an altitude advantage over your opponent.";"Always try to have an altitude advantage over your opponent.";"Always try to have an altitude advantage over your opponent.";"Always try to have an altitude advantage over your opponent.";"Always try to have an altitude advantage over your opponent.";"Always try to have an altitude advantage over your opponent.";"Always try to have an altitude advantage over your opponent.";"Always try to have an altitude advantage over your opponent.";"Always try to have an altitude advantage over your opponent.";;

"loading/aircraft/newbie/tip13";"When a missile is off the rail, it's nobodies friend.";"When a missile is off the rail, it's nobodies friend.";"When a missile is off the rail, it's nobodies friend.";"When a missile is off the rail, it's nobodies friend.";"When a missile is off the rail, it's nobodies friend.";"When a missile is off the rail, it's nobodies friend.";"When a missile is off the rail, it's nobodies friend.";"When a missile is off the rail, it's nobodies friend.";"When a missile is off the rail, it's nobodies friend.";"When a missile is off the rail, it's nobodies friend.";"When a missile is off the rail, it's nobodies friend.";"When a missile is off the rail, it's nobodies friend.";"When a missile is off the rail, it's nobodies friend.";"When a missile is off the rail, it's nobodies friend.";"When a missile is off the rail, it's nobodies friend.";"When a missile is off the rail, it's nobodies friend.";"When a missile is off the rail, it's nobodies friend.";"When a missile is off the rail, it's nobodies friend.";"When a missile is off the rail, it's nobodies friend.";"When a missile is off the rail, it's nobodies friend.";"When a missile is off the rail, it's nobodies friend.";;

"loading/aircraft/newbie/tip15";"Smart bombs have bad days too.";"Smart bombs have bad days too.";"Smart bombs have bad days too.";"Smart bombs have bad days too.";"Smart bombs have bad days too.";"Smart bombs have bad days too.";"Smart bombs have bad days too.";"Smart bombs have bad days too.";"Smart bombs have bad days too.";"Smart bombs have bad days too.";"Smart bombs have bad days too.";"Smart bombs have bad days too.";"Smart bombs have bad days too.";"Smart bombs have bad days too.";"Smart bombs have bad days too.";"Smart bombs have bad days too.";"Smart bombs have bad days too.";"Smart bombs have bad days too.";"Smart bombs have bad days too.";"Smart bombs have bad days too.";"Smart bombs have bad days too.";;
"loading/aircraft/tip16";"The F-15D Baz «957» that landed after losing a wing, was repaired and shared a MiG-23 kill in 1985.";"An aircraft can fly with critical damage, even with only half a wing. You can read more about this in the Encyclopedia.";"An aircraft can fly with critical damage, even with only half a wing. You can read more about this in the Encyclopedia.";"An aircraft can fly with critical damage, even with only half a wing. You can read more about this in the Encyclopedia.";"An aircraft can fly with critical damage, even with only half a wing. You can read more about this in the Encyclopedia.";"An aircraft can fly with critical damage, even with only half a wing. You can read more about this in the Encyclopedia.";"An aircraft can fly with critical damage, even with only half a wing. You can read more about this in the Encyclopedia.";"An aircraft can fly with critical damage, even with only half a wing. You can read more about this in the Encyclopedia.";"An aircraft can fly with critical damage, even with only half a wing. You can read more about this in the Encyclopedia.";"An aircraft can fly with critical damage, even with only half a wing. You can read more about this in the Encyclopedia.";"An aircraft can fly with critical damage, even with only half a wing. You can read more about this in the Encyclopedia.";"An aircraft can fly with critical damage, even with only half a wing. You can read more about this in the Encyclopedia.";"An aircraft can fly with critical damage, even with only half a wing. You can read more about this in the Encyclopedia.";"An aircraft can fly with critical damage, even with only half a wing. You can read more about this in the Encyclopedia.";"An aircraft can fly with critical damage, even with only half a wing. You can read more about this in the Encyclopedia.";"An aircraft can fly with critical damage, even with only half a wing. You can read more about this in the Encyclopedia.";"An aircraft can fly with critical damage, even with only half a wing. You can read more about this in the Encyclopedia.";"An aircraft can fly with critical damage, even with only half a wing. You can read more about this in the Encyclopedia.";"An aircraft can fly with critical damage, even with only half a wing. You can read more about this in the Encyclopedia.";"An aircraft can fly with critical damage, even with only half a wing. You can read more about this in the Encyclopedia.";"An aircraft can fly with critical damage, even with only half a wing. You can read more about this in the Encyclopedia.";;
"loading/aircraft/newbie/tip17";"Early Spitfire models used a carburettor instead of a fuel injection system causing the engine to suffer from fuel starvation, this was only resolved with the introduction of the Spitfire V.";"Watch your altitude carefully, especially when performing maneuvers!";"Watch your altitude carefully, especially when performing maneuvers!";"Watch your altitude carefully, especially when performing maneuvers!";"Watch your altitude carefully, especially when performing maneuvers!";"Watch your altitude carefully, especially when performing maneuvers!";"Watch your altitude carefully, especially when performing maneuvers!";"Watch your altitude carefully, especially when performing maneuvers!";"Watch your altitude carefully, especially when performing maneuvers!";"Watch your altitude carefully, especially when performing maneuvers!";"Watch your altitude carefully, especially when performing maneuvers!";"Watch your altitude carefully, especially when performing maneuvers!";"Watch your altitude carefully, especially when performing maneuvers!";"Watch your altitude carefully, especially when performing maneuvers!";"Watch your altitude carefully, especially when performing maneuvers!";"Watch your altitude carefully, especially when performing maneuvers!";"Watch your altitude carefully, especially when performing maneuvers!";"Watch your altitude carefully, especially when performing maneuvers!";"Watch your altitude carefully, especially when performing maneuvers!";"Watch your altitude carefully, especially when performing maneuvers!";"Watch your altitude carefully, especially when performing maneuvers!";;

"loading/aircraft/tip22";"Even though the USN retired the F-14A in 2004, the Iranian Air Force still has them in service over 20 years later.";"Crashed... for good luck!";"Crashed... for good luck!";"Crashed... for good luck!";"Crashed... for good luck!";"Crashed... for good luck!";"Crashed... for good luck!";"Crashed... for good luck!";"Crashed... for good luck!";"Crashed... for good luck!";"Crashed... for good luck!";"Crashed... for good luck!";"Crashed... for good luck!";"Crashed... for good luck!";"Crashed... for good luck!";"Crashed... for good luck!";"Crashed... for good luck!";"Crashed... for good luck!";"Crashed... for good luck!";"Crashed... for good luck!";"Crashed... for good luck!";;

"loading/aircraft/tip29";"Never fly the ""A"" model of anything.";"For a good pilot, any weather is acceptable.";"For a good pilot, any weather is acceptable.";"For a good pilot, any weather is acceptable.";"For a good pilot, any weather is acceptable.";"For a good pilot, any weather is acceptable.";"For a good pilot, any weather is acceptable.";"For a good pilot, any weather is acceptable.";"For a good pilot, any weather is acceptable.";"For a good pilot, any weather is acceptable.";"For a good pilot, any weather is acceptable.";"For a good pilot, any weather is acceptable.";"For a good pilot, any weather is acceptable.";"For a good pilot, any weather is acceptable.";"For a good pilot, any weather is acceptable.";"For a good pilot, any weather is acceptable.";"For a good pilot, any weather is acceptable.";"For a good pilot, any weather is acceptable.";"For a good pilot, any weather is acceptable.";"For a good pilot, any weather is acceptable.";"For a good pilot, any weather is acceptable.";;
"loading/aircraft/tip30";"Any landing you can walk away from is a good one.";"The aircraft is on the ground, and the pilot’s alive. A successful landing!";"The aircraft is on the ground, and the pilot’s alive. A successful landing!";"The aircraft is on the ground, and the pilot’s alive. A successful landing!";"The aircraft is on the ground, and the pilot’s alive. A successful landing!";"The aircraft is on the ground, and the pilot’s alive. A successful landing!";"The aircraft is on the ground, and the pilot’s alive. A successful landing!";"The aircraft is on the ground, and the pilot’s alive. A successful landing!";"The aircraft is on the ground, and the pilot’s alive. A successful landing!";"The aircraft is on the ground, and the pilot’s alive. A successful landing!";"The aircraft is on the ground, and the pilot’s alive. A successful landing!";"The aircraft is on the ground, and the pilot’s alive. A successful landing!";"The aircraft is on the ground, and the pilot’s alive. A successful landing!";"The aircraft is on the ground, and the pilot’s alive. A successful landing!";"The aircraft is on the ground, and the pilot’s alive. A successful landing!";"The aircraft is on the ground, and the pilot’s alive. A successful landing!";"The aircraft is on the ground, and the pilot’s alive. A successful landing!";"The aircraft is on the ground, and the pilot’s alive. A successful landing!";"The aircraft is on the ground, and the pilot’s alive. A successful landing!";"The aircraft is on the ground, and the pilot’s alive. A successful landing!";"The aircraft is on the ground, and the pilot’s alive. A successful landing!";;

