"<ID|readonly|noverify>";"<English>";"<French>";"<Italian>";"<German>";"<Spanish>";"<Russian>";"<Polish>";"<Czech>";"<Turkish>";"<Chinese>";"<Japanese>";"<Portuguese>";"<Ukrainian>";"<Serbian>";"<Hungarian>";"<Korean>";"<Belarusian>";"<Romanian>";"<TChinese>";"<HChinese>";"<Vietnamese>";"<Comments>";"<max_chars>"
"loading/aircraft/tip69";"Many wanted to decommission the SBD before the war even began, but it still took part in the hostilities and in 1942 sunk more enemy ships than any other naval aircraft.";"Many wanted to decommission the SBD before the war even began, but it still took part in the hostilities and in 1942 sunk more enemy ships than any other naval aircraft.";"Many wanted to decommission the SBD before the war even began, but it still took part in the hostilities and in 1942 sunk more enemy ships than any other naval aircraft.";"Many wanted to decommission the SBD before the war even began, but it still took part in the hostilities and in 1942 sunk more enemy ships than any other naval aircraft.";"Many wanted to decommission the SBD before the war even began, but it still took part in the hostilities and in 1942 sunk more enemy ships than any other naval aircraft.";"Many wanted to decommission the SBD before the war even began, but it still took part in the hostilities and in 1942 sunk more enemy ships than any other naval aircraft.";"Many wanted to decommission the SBD before the war even began, but it still took part in the hostilities and in 1942 sunk more enemy ships than any other naval aircraft.";"Many wanted to decommission the SBD before the war even began, but it still took part in the hostilities and in 1942 sunk more enemy ships than any other naval aircraft.";"Many wanted to decommission the SBD before the war even began, but it still took part in the hostilities and in 1942 sunk more enemy ships than any other naval aircraft.";"Many wanted to decommission the SBD before the war even began, but it still took part in the hostilities and in 1942 sunk more enemy ships than any other naval aircraft.";"Many wanted to decommission the SBD before the war even began, but it still took part in the hostilities and in 1942 sunk more enemy ships than any other naval aircraft.";"Many wanted to decommission the SBD before the war even began, but it still took part in the hostilities and in 1942 sunk more enemy ships than any other naval aircraft.";"Many wanted to decommission the SBD before the war even began, but it still took part in the hostilities and in 1942 sunk more enemy ships than any other naval aircraft.";"Many wanted to decommission the SBD before the war even began, but it still took part in the hostilities and in 1942 sunk more enemy ships than any other naval aircraft.";"Many wanted to decommission the SBD before the war even began, but it still took part in the hostilities and in 1942 sunk more enemy ships than any other naval aircraft.";"Many wanted to decommission the SBD before the war even began, but it still took part in the hostilities and in 1942 sunk more enemy ships than any other naval aircraft.";"Many wanted to decommission the SBD before the war even began, but it still took part in the hostilities and in 1942 sunk more enemy ships than any other naval aircraft.";"Many wanted to decommission the SBD before the war even began, but it still took part in the hostilities and in 1942 sunk more enemy ships than any other naval aircraft.";"Many wanted to decommission the SBD before the war even began, but it still took part in the hostilities and in 1942 sunk more enemy ships than any other naval aircraft.";"Many wanted to decommission the SBD before the war even began, but it still took part in the hostilities and in 1942 sunk more enemy ships than any other naval aircraft.";"Many wanted to decommission the SBD before the war even began, but it still took part in the hostilities and in 1942 sunk more enemy ships than any other naval aircraft.";;
"loading/aircraft/tip70";"Thanks to its hydraulic wings, the TBF could be packed or unpacked by the pilot in just a few seconds.";"Thanks to its hydraulic wings, the TBF could be packed or unpacked by the pilot in just a few seconds.";"Thanks to its hydraulic wings, the TBF could be packed or unpacked by the pilot in just a few seconds.";"Thanks to its hydraulic wings, the TBF could be packed or unpacked by the pilot in just a few seconds.";"Thanks to its hydraulic wings, the TBF could be packed or unpacked by the pilot in just a few seconds.";"Thanks to its hydraulic wings, the TBF could be packed or unpacked by the pilot in just a few seconds.";"Thanks to its hydraulic wings, the TBF could be packed or unpacked by the pilot in just a few seconds.";"Thanks to its hydraulic wings, the TBF could be packed or unpacked by the pilot in just a few seconds.";"Thanks to its hydraulic wings, the TBF could be packed or unpacked by the pilot in just a few seconds.";"Thanks to its hydraulic wings, the TBF could be packed or unpacked by the pilot in just a few seconds.";"Thanks to its hydraulic wings, the TBF could be packed or unpacked by the pilot in just a few seconds.";"Thanks to its hydraulic wings, the TBF could be packed or unpacked by the pilot in just a few seconds.";"Thanks to its hydraulic wings, the TBF could be packed or unpacked by the pilot in just a few seconds.";"Thanks to its hydraulic wings, the TBF could be packed or unpacked by the pilot in just a few seconds.";"Thanks to its hydraulic wings, the TBF could be packed or unpacked by the pilot in just a few seconds.";"Thanks to its hydraulic wings, the TBF could be packed or unpacked by the pilot in just a few seconds.";"Thanks to its hydraulic wings, the TBF could be packed or unpacked by the pilot in just a few seconds.";"Thanks to its hydraulic wings, the TBF could be packed or unpacked by the pilot in just a few seconds.";"Thanks to its hydraulic wings, the TBF could be packed or unpacked by the pilot in just a few seconds.";"Thanks to its hydraulic wings, the TBF could be packed or unpacked by the pilot in just a few seconds.";"Thanks to its hydraulic wings, the TBF could be packed or unpacked by the pilot in just a few seconds.";;
"loading/aircraft/tip71";"The Tempest saw its first mass use by the RAF during the Allied landings at Normandy.";"The Tempest saw its first mass use by the RAF during the Allied landings at Normandy.";"The Tempest saw its first mass use by the RAF during the Allied landings at Normandy.";"The Tempest saw its first mass use by the RAF during the Allied landings at Normandy.";"The Tempest saw its first mass use by the RAF during the Allied landings at Normandy.";"The Tempest saw its first mass use by the RAF during the Allied landings at Normandy.";"The Tempest saw its first mass use by the RAF during the Allied landings at Normandy.";"The Tempest saw its first mass use by the RAF during the Allied landings at Normandy.";"The Tempest saw its first mass use by the RAF during the Allied landings at Normandy.";"The Tempest saw its first mass use by the RAF during the Allied landings at Normandy.";"The Tempest saw its first mass use by the RAF during the Allied landings at Normandy.";"The Tempest saw its first mass use by the RAF during the Allied landings at Normandy.";"The Tempest saw its first mass use by the RAF during the Allied landings at Normandy.";"The Tempest saw its first mass use by the RAF during the Allied landings at Normandy.";"The Tempest saw its first mass use by the RAF during the Allied landings at Normandy.";"The Tempest saw its first mass use by the RAF during the Allied landings at Normandy.";"The Tempest saw its first mass use by the RAF during the Allied landings at Normandy.";"The Tempest saw its first mass use by the RAF during the Allied landings at Normandy.";"The Tempest saw its first mass use by the RAF during the Allied landings at Normandy.";"The Tempest saw its first mass use by the RAF during the Allied landings at Normandy.";"The Tempest saw its first mass use by the RAF during the Allied landings at Normandy.";;
"loading/aircraft/tip72";"The Brewster F2A Buffalo was the first carrier-based monoplane used by the U.S. Navy.";"The Brewster F2A Buffalo was the first carrier-based monoplane used by the U.S. Navy.";"The Brewster F2A Buffalo was the first carrier-based monoplane used by the U.S. Navy.";"The Brewster F2A Buffalo was the first carrier-based monoplane used by the U.S. Navy.";"The Brewster F2A Buffalo was the first carrier-based monoplane used by the U.S. Navy.";"The Brewster F2A Buffalo was the first carrier-based monoplane used by the U.S. Navy.";"The Brewster F2A Buffalo was the first carrier-based monoplane used by the U.S. Navy.";"The Brewster F2A Buffalo was the first carrier-based monoplane used by the U.S. Navy.";"The Brewster F2A Buffalo was the first carrier-based monoplane used by the U.S. Navy.";"The Brewster F2A Buffalo was the first carrier-based monoplane used by the U.S. Navy.";"The Brewster F2A Buffalo was the first carrier-based monoplane used by the U.S. Navy.";"The Brewster F2A Buffalo was the first carrier-based monoplane used by the U.S. Navy.";"The Brewster F2A Buffalo was the first carrier-based monoplane used by the U.S. Navy.";"The Brewster F2A Buffalo was the first carrier-based monoplane used by the U.S. Navy.";"The Brewster F2A Buffalo was the first carrier-based monoplane used by the U.S. Navy.";"The Brewster F2A Buffalo was the first carrier-based monoplane used by the U.S. Navy.";"The Brewster F2A Buffalo was the first carrier-based monoplane used by the U.S. Navy.";"The Brewster F2A Buffalo was the first carrier-based monoplane used by the U.S. Navy.";"The Brewster F2A Buffalo was the first carrier-based monoplane used by the U.S. Navy.";"The Brewster F2A Buffalo was the first carrier-based monoplane used by the U.S. Navy.";"The Brewster F2A Buffalo was the first carrier-based monoplane used by the U.S. Navy.";;
"loading/aircraft/tip73";"The OS2U played numerous roles, including artillery spotter and even providing cover for amphibious operations.";"The OS2U played numerous roles, including artillery spotter and even providing cover for amphibious operations.";"The OS2U played numerous roles, including artillery spotter and even providing cover for amphibious operations.";"The OS2U played numerous roles, including artillery spotter and even providing cover for amphibious operations.";"The OS2U played numerous roles, including artillery spotter and even providing cover for amphibious operations.";"The OS2U played numerous roles, including artillery spotter and even providing cover for amphibious operations.";"The OS2U played numerous roles, including artillery spotter and even providing cover for amphibious operations.";"The OS2U played numerous roles, including artillery spotter and even providing cover for amphibious operations.";"The OS2U played numerous roles, including artillery spotter and even providing cover for amphibious operations.";"The OS2U played numerous roles, including artillery spotter and even providing cover for amphibious operations.";"The OS2U played numerous roles, including artillery spotter and even providing cover for amphibious operations.";"The OS2U played numerous roles, including artillery spotter and even providing cover for amphibious operations.";"The OS2U played numerous roles, including artillery spotter and even providing cover for amphibious operations.";"The OS2U played numerous roles, including artillery spotter and even providing cover for amphibious operations.";"The OS2U played numerous roles, including artillery spotter and even providing cover for amphibious operations.";"The OS2U played numerous roles, including artillery spotter and even providing cover for amphibious operations.";"The OS2U played numerous roles, including artillery spotter and even providing cover for amphibious operations.";"The OS2U played numerous roles, including artillery spotter and even providing cover for amphibious operations.";"The OS2U played numerous roles, including artillery spotter and even providing cover for amphibious operations.";"The OS2U played numerous roles, including artillery spotter and even providing cover for amphibious operations.";"The OS2U played numerous roles, including artillery spotter and even providing cover for amphibious operations.";;
"loading/aircraft/tip74";"The tropical variant, the Bf.109F-4, protected the pilot from overheating on the ground with a mounted umbrella covering the cockpit.";"The tropical variant, the Bf.109F-4, protected the pilot from overheating on the ground with a mounted umbrella covering the cockpit.";"The tropical variant, the Bf.109F-4, protected the pilot from overheating on the ground with a mounted umbrella covering the cockpit.";"The tropical variant, the Bf.109F-4, protected the pilot from overheating on the ground with a mounted umbrella covering the cockpit.";"The tropical variant, the Bf.109F-4, protected the pilot from overheating on the ground with a mounted umbrella covering the cockpit.";"The tropical variant, the Bf.109F-4, protected the pilot from overheating on the ground with a mounted umbrella covering the cockpit.";"The tropical variant, the Bf.109F-4, protected the pilot from overheating on the ground with a mounted umbrella covering the cockpit.";"The tropical variant, the Bf.109F-4, protected the pilot from overheating on the ground with a mounted umbrella covering the cockpit.";"The tropical variant, the Bf.109F-4, protected the pilot from overheating on the ground with a mounted umbrella covering the cockpit.";"The tropical variant, the Bf.109F-4, protected the pilot from overheating on the ground with a mounted umbrella covering the cockpit.";"The tropical variant, the Bf.109F-4, protected the pilot from overheating on the ground with a mounted umbrella covering the cockpit.";"The tropical variant, the Bf.109F-4, protected the pilot from overheating on the ground with a mounted umbrella covering the cockpit.";"The tropical variant, the Bf.109F-4, protected the pilot from overheating on the ground with a mounted umbrella covering the cockpit.";"The tropical variant, the Bf.109F-4, protected the pilot from overheating on the ground with a mounted umbrella covering the cockpit.";"The tropical variant, the Bf.109F-4, protected the pilot from overheating on the ground with a mounted umbrella covering the cockpit.";"The tropical variant, the Bf.109F-4, protected the pilot from overheating on the ground with a mounted umbrella covering the cockpit.";"The tropical variant, the Bf.109F-4, protected the pilot from overheating on the ground with a mounted umbrella covering the cockpit.";"The tropical variant, the Bf.109F-4, protected the pilot from overheating on the ground with a mounted umbrella covering the cockpit.";"The tropical variant, the Bf.109F-4, protected the pilot from overheating on the ground with a mounted umbrella covering the cockpit.";"The tropical variant, the Bf.109F-4, protected the pilot from overheating on the ground with a mounted umbrella covering the cockpit.";"The tropical variant, the Bf.109F-4, protected the pilot from overheating on the ground with a mounted umbrella covering the cockpit.";;
"loading/aircraft/tip75";"The absence of armor on the H6K4 was due to the plane’s long range (up to 6000 km).";"The absence of armor on the H6K4 was due to the plane’s long range (up to 6000 km).";"The absence of armor on the H6K4 was due to the plane’s long range (up to 6000 km).";"The absence of armor on the H6K4 was due to the plane’s long range (up to 6000 km).";"The absence of armor on the H6K4 was due to the plane’s long range (up to 6000 km).";"The absence of armor on the H6K4 was due to the plane’s long range (up to 6000 km).";"The absence of armor on the H6K4 was due to the plane’s long range (up to 6000 km).";"The absence of armor on the H6K4 was due to the plane’s long range (up to 6000 km).";"The absence of armor on the H6K4 was due to the plane’s long range (up to 6000 km).";"The absence of armor on the H6K4 was due to the plane’s long range (up to 6000 km).";"The absence of armor on the H6K4 was due to the plane’s long range (up to 6000 km).";"The absence of armor on the H6K4 was due to the plane’s long range (up to 6000 km).";"The absence of armor on the H6K4 was due to the plane’s long range (up to 6000 km).";"The absence of armor on the H6K4 was due to the plane’s long range (up to 6000 km).";"The absence of armor on the H6K4 was due to the plane’s long range (up to 6000 km).";"The absence of armor on the H6K4 was due to the plane’s long range (up to 6000 km).";"The absence of armor on the H6K4 was due to the plane’s long range (up to 6000 km).";"The absence of armor on the H6K4 was due to the plane’s long range (up to 6000 km).";"The absence of armor on the H6K4 was due to the plane’s long range (up to 6000 km).";"The absence of armor on the H6K4 was due to the plane’s long range (up to 6000 km).";"The absence of armor on the H6K4 was due to the plane’s long range (up to 6000 km).";;
"loading/aircraft/tip76";"The PBY Catalina was the most popular seaplane; some are still in civilian use.";"The PBY Catalina was the most popular seaplane; some are still in civilian use.";"The PBY Catalina was the most popular seaplane; some are still in civilian use.";"The PBY Catalina was the most popular seaplane; some are still in civilian use.";"The PBY Catalina was the most popular seaplane; some are still in civilian use.";"The PBY Catalina was the most popular seaplane; some are still in civilian use.";"The PBY Catalina was the most popular seaplane; some are still in civilian use.";"The PBY Catalina was the most popular seaplane; some are still in civilian use.";"The PBY Catalina was the most popular seaplane; some are still in civilian use.";"The PBY Catalina was the most popular seaplane; some are still in civilian use.";"The PBY Catalina was the most popular seaplane; some are still in civilian use.";"The PBY Catalina was the most popular seaplane; some are still in civilian use.";"The PBY Catalina was the most popular seaplane; some are still in civilian use.";"The PBY Catalina was the most popular seaplane; some are still in civilian use.";"The PBY Catalina was the most popular seaplane; some are still in civilian use.";"The PBY Catalina was the most popular seaplane; some are still in civilian use.";"The PBY Catalina was the most popular seaplane; some are still in civilian use.";"The PBY Catalina was the most popular seaplane; some are still in civilian use.";"The PBY Catalina was the most popular seaplane; some are still in civilian use.";"The PBY Catalina was the most popular seaplane; some are still in civilian use.";"The PBY Catalina was the most popular seaplane; some are still in civilian use.";;
"loading/aircraft/tip77";"The A5M was the world's first monoplane carrier-based fighter.";"The A5M was the world's first monoplane carrier-based fighter.";"The A5M was the world's first monoplane carrier-based fighter.";"The A5M was the world's first monoplane carrier-based fighter.";"The A5M was the world's first monoplane carrier-based fighter.";"The A5M was the world's first monoplane carrier-based fighter.";"The A5M was the world's first monoplane carrier-based fighter.";"The A5M was the world's first monoplane carrier-based fighter.";"The A5M was the world's first monoplane carrier-based fighter.";"The A5M was the world's first monoplane carrier-based fighter.";"The A5M was the world's first monoplane carrier-based fighter.";"The A5M was the world's first monoplane carrier-based fighter.";"The A5M was the world's first monoplane carrier-based fighter.";"The A5M was the world's first monoplane carrier-based fighter.";"The A5M was the world's first monoplane carrier-based fighter.";"The A5M was the world's first monoplane carrier-based fighter.";"The A5M was the world's first monoplane carrier-based fighter.";"The A5M was the world's first monoplane carrier-based fighter.";"The A5M was the world's first monoplane carrier-based fighter.";"The A5M was the world's first monoplane carrier-based fighter.";"The A5M was the world's first monoplane carrier-based fighter.";;
//"loading/help_consoleTip";;;;;;;;;;;;;;;;;;;;;;"let it be empty";//
//ground//
"loading/tank/tip9";"Full calibre AP shells have less penetrating power than APCR or APDS shells, but they do more damage in case of successful penetration.";"Full calibre AP shells have less penetrating power than APCR or APDS shells, but they do more damage in case of successful penetration.";"Full calibre AP shells have less penetrating power than APCR or APDS shells, but they do more damage in case of successful penetration.";"Full calibre AP shells have less penetrating power than APCR or APDS shells, but they do more damage in case of successful penetration.";"Full calibre AP shells have less penetrating power than APCR or APDS shells, but they do more damage in case of successful penetration.";"Full calibre AP shells have less penetrating power than APCR or APDS shells, but they do more damage in case of successful penetration.";"Full calibre AP shells have less penetrating power than APCR or APDS shells, but they do more damage in case of successful penetration.";"Full calibre AP shells have less penetrating power than APCR or APDS shells, but they do more damage in case of successful penetration.";"Full calibre AP shells have less penetrating power than APCR or APDS shells, but they do more damage in case of successful penetration.";"Full calibre AP shells have less penetrating power than APCR or APDS shells, but they do more damage in case of successful penetration.";"Full calibre AP shells have less penetrating power than APCR or APDS shells, but they do more damage in case of successful penetration.";"Full calibre AP shells have less penetrating power than APCR or APDS shells, but they do more damage in case of successful penetration.";"Full calibre AP shells have less penetrating power than APCR or APDS shells, but they do more damage in case of successful penetration.";"Full calibre AP shells have less penetrating power than APCR or APDS shells, but they do more damage in case of successful penetration.";"Full calibre AP shells have less penetrating power than APCR or APDS shells, but they do more damage in case of successful penetration.";"Full calibre AP shells have less penetrating power than APCR or APDS shells, but they do more damage in case of successful penetration.";"Full calibre AP shells have less penetrating power than APCR or APDS shells, but they do more damage in case of successful penetration.";"Full calibre AP shells have less penetrating power than APCR or APDS shells, but they do more damage in case of successful penetration.";"Full calibre AP shells have less penetrating power than APCR or APDS shells, but they do more damage in case of successful penetration.";"Full calibre AP shells have less penetrating power than APCR or APDS shells, but they do more damage in case of successful penetration.";"Full calibre AP shells have less penetrating power than APCR or APDS shells, but they do more damage in case of successful penetration.";;
